{
  "project_name": "Transit Station Site Acquisition - Yonge & Eglinton",
  "issue": "Board approval required for $1,850,000 property acquisition to secure transit station site",
  "urgency": "high",
  "background": {
    "context": "The Yonge-Eglinton Crosstown LRT project requires acquisition of 2550 Yonge Street for the new transit station. This is a strategic site at a major transit hub with existing subway and planned LRT connections. Early acquisition is critical to maintain project schedule and avoid cost escalation. The property is currently occupied by a 3-storey mixed-use building with ground floor retail and residential units above.",
    "project_timeline": {
      "start_date": "2025-01-15",
      "key_milestones": [
        {
          "milestone": "Initial site identification and feasibility study",
          "date": "2025-01-15",
          "status": "completed"
        },
        {
          "milestone": "Property appraisal and valuation",
          "date": "2025-02-28",
          "status": "completed"
        },
        {
          "milestone": "Owner negotiations commenced",
          "date": "2025-03-15",
          "status": "completed"
        },
        {
          "milestone": "Board approval deadline",
          "date": "2025-11-30",
          "status": "pending"
        },
        {
          "milestone": "Close transaction and take possession",
          "date": "2026-01-31",
          "status": "pending"
        },
        {
          "milestone": "Station construction commencement",
          "date": "2026-04-01",
          "status": "pending"
        }
      ],
      "critical_deadline": "2026-01-31"
    },
    "stakeholders": [
      {
        "name": "Property Owner (2550 Yonge Inc.)",
        "role": "Seller",
        "position": "neutral"
      },
      {
        "name": "Transit Expansion Division",
        "role": "Project Lead",
        "position": "supportive"
      },
      {
        "name": "Finance Committee",
        "role": "Budget Approval Authority",
        "position": "neutral"
      },
      {
        "name": "City Planning Department",
        "role": "Zoning and Development",
        "position": "supportive"
      },
      {
        "name": "Local Community Association",
        "role": "Community Representative",
        "position": "supportive"
      }
    ]
  },
  "financial_summary": {
    "total_cost": 1850000,
    "breakdown": {
      "acquisition": 1650000,
      "legal": 75000,
      "expert": 50000,
      "disturbance": 60000,
      "other": 15000
    },
    "contingency": 185000,
    "contingency_pct": 0.10,
    "budget_comparison": {
      "approved_budget": 1700000,
      "variance": 150000,
      "variance_pct": 8.82
    },
    "funding_source": "Transit Expansion Capital Fund 2025-2026"
  },
  "analysis": {
    "strategic_rationale": "This acquisition is strategically critical for the Yonge-Eglinton transit hub development. The site provides optimal multi-modal connectivity with existing subway Lines 1 and 2, plus the planned Crosstown LRT. Early acquisition prevents holdout risk and cost escalation in a rapidly appreciating market. The location supports Transit-Oriented Development (TOD) with high existing density (350+ people/hectare) and strong pedestrian catchment (45,000+ within 800m walk radius).",
    "alternatives_considered": [
      {
        "alternative": "Alternative Site A - 2600 Yonge Street",
        "pros": [
          "Lower acquisition cost ($1,400,000)",
          "Vacant land - no relocation required",
          "Simpler ownership structure"
        ],
        "cons": [
          "200m further from optimal transit connection point",
          "Poor pedestrian access - requires underground tunnel",
          "Additional construction costs estimated at $800,000 for tunnel"
        ],
        "cost": 2200000,
        "timeline_impact": "6 month delay for tunnel construction"
      },
      {
        "alternative": "Alternative Site B - 2500 Yonge Street",
        "pros": [
          "Better TOD potential - larger development site",
          "Adjacent to existing subway entrance"
        ],
        "cons": [
          "Heritage building designation - cannot demolish",
          "Owner refuses to sell",
          "Expropriation would delay project 18+ months"
        ],
        "cost": 1600000,
        "timeline_impact": "18+ month delay for expropriation hearing"
      },
      {
        "alternative": "Defer acquisition - negotiate longer",
        "pros": [
          "Potential for lower price if market softens",
          "More time for due diligence"
        ],
        "cons": [
          "Risk of market appreciation ($50k-100k/month)",
          "Owner may engage other buyers",
          "Delays entire LRT project timeline",
          "Increases risk of holdout and expropriation"
        ],
        "cost": 2100000,
        "timeline_impact": "3-6 month delay, potential 18 month expropriation"
      }
    ],
    "benefits": [
      "Secures optimal site for major transit hub (Lines 1, 2, Crosstown LRT)",
      "Maintains LRT project schedule - avoids cascading delays",
      "Prevents holdout risk and cost escalation in hot market",
      "Supports Transit-Oriented Development (TOD) with high density (350+ people/hectare)",
      "Strong pedestrian catchment (45,000 people within 800m)",
      "Willing seller at market value - avoids expropriation costs and delays"
    ],
    "precedents": [
      {
        "project": "Eglinton Crosstown - Mount Dennis Station (2018)",
        "similarity": "Similar multi-parcel assembly, comparable market conditions",
        "outcome": "Successful negotiated acquisition at $1.2M. Early acquisition saved estimated $400k vs. delayed purchase."
      },
      {
        "project": "Line 1 Extension - Vaughan Station (2019)",
        "similarity": "Mixed-use building acquisition for station entrance",
        "outcome": "Negotiated settlement at appraised value avoided 14-month expropriation delay and $200k legal costs."
      }
    ]
  },
  "recommendation": "Approve acquisition of 2550 Yonge Street at $1,850,000",
  "rationale": "Recommended acquisition at $1.85M is 12% above budget but represents best value when considering alternatives. Alternative sites would result in higher all-in costs ($2.2M for Site A with tunnel, $1.6M base for Site B plus 18-month expropriation delay worth $500k+). Deferring acquisition risks market appreciation ($50k-100k/month) and potential holdout. Owner is willing seller at appraised market value - delaying risks losing cooperation and forcing expropriation. Strategic location optimizes transit connectivity and TOD potential.",
  "risks": [
    {
      "risk": "Budget overrun - acquisition cost 8.8% above approved budget",
      "severity": "MEDIUM",
      "probability": 1.0,
      "impact": "Requires budget reallocation or supplementary approval",
      "mitigation": "Secure contingency approval from Finance Committee. Offset with savings from other line items in Transit Expansion Fund.",
      "owner": "VP Finance"
    },
    {
      "risk": "Tenant relocation delays - commercial tenant has 6-month lease remainder",
      "severity": "MEDIUM",
      "probability": 0.4,
      "impact": "Potential 3-6 month delay in taking possession",
      "mitigation": "Negotiate early termination with tenant. Offer relocation assistance ($60k disturbance budget). Include vacant possession requirement in purchase agreement.",
      "owner": "Acquisitions Manager"
    },
    {
      "risk": "Environmental contamination - former gas station on adjacent property",
      "severity": "HIGH",
      "probability": 0.3,
      "impact": "Remediation costs $200k-500k, potential 4-8 month delay",
      "mitigation": "Phase II Environmental Site Assessment prior to closing. Include environmental indemnity in purchase agreement. Budget contingency for remediation.",
      "owner": "Environmental Compliance Officer"
    },
    {
      "risk": "Owner withdrawal - seller may entertain competing offers during approval process",
      "severity": "HIGH",
      "probability": 0.25,
      "impact": "Loss of site, forced to pursue alternatives or expropriation (18+ month delay, $500k+ additional costs)",
      "mitigation": "Execute binding Agreement of Purchase and Sale with deposit upon Board approval. Expedite approval process (target 30 days). Maintain strong relationship with seller.",
      "owner": "Acquisitions Manager"
    },
    {
      "risk": "Title defects - potential unregistered easements or encroachments",
      "severity": "LOW",
      "probability": 0.2,
      "impact": "Minor title clearing costs $10k-25k, potential 2-4 week delay",
      "mitigation": "Complete title search and survey prior to closing. Include title insurance requirement. Budget for minor title clearing.",
      "owner": "Legal Counsel"
    }
  ],
  "action_items": [
    {
      "action": "Obtain Board approval for $1,850,000 acquisition",
      "responsible": "VP Transit Expansion",
      "deadline": "2025-11-30",
      "priority": "HIGH",
      "dependencies": []
    },
    {
      "action": "Secure budget reallocation or supplementary approval for $150k variance",
      "responsible": "VP Finance",
      "deadline": "2025-11-30",
      "priority": "HIGH",
      "dependencies": ["Obtain Board approval for $1,850,000 acquisition"]
    },
    {
      "action": "Execute binding Agreement of Purchase and Sale with 5% deposit",
      "responsible": "Legal Counsel",
      "deadline": "2025-12-15",
      "priority": "HIGH",
      "dependencies": ["Obtain Board approval for $1,850,000 acquisition"]
    },
    {
      "action": "Complete Phase II Environmental Site Assessment",
      "responsible": "Environmental Compliance Officer",
      "deadline": "2025-12-31",
      "priority": "HIGH",
      "dependencies": ["Execute binding Agreement of Purchase and Sale with 5% deposit"]
    },
    {